{
  "as_of": "2026-06-30T23:59:59Z",
  "case_id": "vectorforge-before-v1",
  "claims": [
    {
      "claim_id": "C1",
      "counterevidence": [],
      "evidence": [],
      "kind": "fact",
      "materiality": "high",
      "statement": "VectorForge has $4.8 million of contracted ARR."
    },
    {
      "claim_id": "C2",
      "counterevidence": [],
      "evidence": [],
      "kind": "judgment",
      "materiality": "high",
      "statement": "VectorForge is an attractive Series A investment."
    }
  ],
  "company": "VectorForge AI (synthetic)",
  "generated_at": "2026-06-30T23:59:59Z",
  "open_questions": [
    "What portion of reported ARR is contracted and non-cancellable?",
    "What evidence would falsify the investment thesis?"
  ],
  "schema_version": "ic-evidence-lab.case/v2",
  "source_policy": {
    "minimum_tier": {
      "derived": {
        "high": "B",
        "low": "C",
        "medium": "B"
      },
      "fact": {
        "high": "B",
        "low": "C",
        "medium": "B"
      }
    }
  },
  "sources": [
    {
      "path": "sources/founder-kpi-memo.txt",
      "published_at": "2026-06-20T12:00:00Z",
      "retrieved_at": "2026-06-30T12:00:00Z",
      "sha256": "c24a0ce01dd74ec6111cb9b771bad561b54c62200b7ad1bc5fd5bbed3a74d3f3",
      "source_id": "S1",
      "source_type": "synthetic_dataroom",
      "tier": "B",
      "uri": "synthetic://vectorforge/founder-kpi-memo",
      "payload_kind": "raw_document"
    }
  ]
}
